{
  "$schema": "schema/foundations.schema.json",
  "tokens": {
    "resolvedFile": "tokens/fluent.resolved.json",
    "dtcgFile": "tokens/fluent.tokens.json",
    "tiers": [
      {
        "name": "global",
        "holds": "Values: the grey and brand ramps, font sizes and families, spacing, radii, stroke widths, durations, curves and the shadow ramp.",
        "readByComponents": "Yes, for everything but colour: a component reads its sizes, spacing, radius and motion from global tokens."
      },
      {
        "name": "alias",
        "holds": "Colour roles over the globals: color{Family}{Role}{Level}{State}. The only tier a component reads colour from.",
        "readByComponents": true
      }
    ],
    "themes": [
      {
        "key": "value",
        "theme": "webLightTheme",
        "text": "The default: web brand ramp, light."
      },
      {
        "key": "dark",
        "theme": "webDarkTheme",
        "text": "Web brand ramp, dark."
      },
      {
        "key": "highContrast",
        "theme": "teamsHighContrastTheme",
        "text": "Windows high contrast: the eight system colours only (see highContrast)."
      },
      {
        "key": "teamsLight",
        "theme": "teamsLightTheme",
        "text": "The Teams brand ramp; differs from value only where brand enters."
      },
      {
        "key": "teamsDark",
        "theme": "teamsDarkTheme",
        "text": "The Teams brand ramp, dark."
      }
    ],
    "naming": {
      "text": "A colour token reads color, family, role, level, state: colorNeutralBackground1Hover is the neutral family, background role, level 1, hover state. A token with no state suffix is the rest value.",
      "families": [
        "Neutral",
        "Brand",
        "Compound",
        "Subtle",
        "Transparent",
        "Status",
        "Palette",
        "Scrollbar"
      ],
      "roles": [
        "Foreground",
        "Background",
        "Stroke",
        "Shadow"
      ],
      "modifiers": [
        "Inverted",
        "Static",
        "Disabled",
        "Accessible",
        "Link",
        "OnBrand",
        "Alpha",
        "Pressed",
        "Hover",
        "Selected"
      ],
      "states": [
        "Hover",
        "Pressed",
        "Selected",
        "Disabled"
      ]
    },
    "rules": [
      {
        "text": "There are no component tokens. A component's styles file hard-codes its sizes, spacing choices and which alias tokens it reads; a spec carries those numbers in values and cites the file."
      },
      {
        "text": "Interaction states are separate tokens, not layers over the rest colour: hover reads colorNeutralBackground1Hover, pressed colorNeutralBackground1Pressed. Never derive a state colour by blending.",
        "tokens": [
          "tokens.colorNeutralBackground1",
          "tokens.colorNeutralBackground1Hover",
          "tokens.colorNeutralBackground1Pressed"
        ]
      },
      {
        "text": "Theme by replacing alias values; the resolved file gives each theme's value under its key. A brand theme replaces the brand ramp, which the alias file reads as brand[10..160]."
      },
      {
        "text": "In fluent.resolved.json a token is {tier, type, value, dark?, highContrast?, teamsLight?, teamsDark?, alias?}; a theme key appears only where that theme differs from value."
      }
    ],
    "units": {
      "dimension": "px, at 1x; scale by the display's device pixel ratio.",
      "duration": "ms",
      "cubicBezier": "[x1, y1, x2, y2] control points of a CSS cubic-bezier.",
      "color": "#rrggbb, or #rrggbbaa where the source keeps an alpha colour; the source's rgba() and transparent are normalised to that.",
      "shadow": "Layers of {x, y, blur, color}, ambient first, no spread; paint every layer.",
      "typography": "{fontFamily token name, fontSize px, fontWeight, lineHeight px}; no letter spacing."
    },
    "stateVocabulary": [
      "rest",
      "hover",
      "pressed",
      "selected",
      "disabled",
      "focus"
    ]
  },
  "color": {
    "families": [
      {
        "name": "neutral",
        "text": "Greys for surfaces, text and strokes. Foreground 1 is primary text, 2 secondary, 3 tertiary, 4 placeholder-weight; Background 1 is the top surface, 2 to 6 step down behind it.",
        "tokens": [
          "tokens.colorNeutralForeground1",
          "tokens.colorNeutralForeground2",
          "tokens.colorNeutralForeground3",
          "tokens.colorNeutralForeground4",
          "tokens.colorNeutralBackground1",
          "tokens.colorNeutralBackground2",
          "tokens.colorNeutralBackground3",
          "tokens.colorNeutralBackground4",
          "tokens.colorNeutralBackground5",
          "tokens.colorNeutralBackground6"
        ]
      },
      {
        "name": "brand",
        "text": "The accent: brand backgrounds for primary actions with colorNeutralForegroundOnBrand on them, brand foregrounds for links and selected marks, brand strokes for selection.",
        "tokens": [
          "tokens.colorBrandBackground",
          "tokens.colorBrandBackgroundHover",
          "tokens.colorBrandBackgroundPressed",
          "tokens.colorNeutralForegroundOnBrand",
          "tokens.colorBrandForeground1",
          "tokens.colorBrandForeground2",
          "tokens.colorBrandStroke1",
          "tokens.colorBrandStroke2",
          "tokens.colorCompoundBrandBackground",
          "tokens.colorCompoundBrandForeground1",
          "tokens.colorCompoundBrandStroke"
        ]
      },
      {
        "name": "subtle",
        "text": "Transparent at rest, a neutral tint on hover and press: the family for subtle buttons and menu items.",
        "tokens": [
          "tokens.colorSubtleBackground",
          "tokens.colorSubtleBackgroundHover",
          "tokens.colorSubtleBackgroundPressed",
          "tokens.colorSubtleBackgroundSelected"
        ]
      },
      {
        "name": "transparent",
        "text": "Explicitly nothing, for a stroke or background a component must set but not show.",
        "tokens": [
          "tokens.colorTransparentBackground",
          "tokens.colorTransparentStroke",
          "tokens.colorTransparentStrokeInteractive",
          "tokens.colorTransparentStrokeDisabled"
        ]
      },
      {
        "name": "status",
        "text": "Success, warning and danger, each with a background, a foreground and a border, mapped onto the green, orange and cranberry palettes.",
        "tokens": [
          "tokens.colorStatusSuccessBackground1",
          "tokens.colorStatusSuccessForeground1",
          "tokens.colorStatusWarningBackground1",
          "tokens.colorStatusWarningForeground1",
          "tokens.colorStatusDangerBackground1",
          "tokens.colorStatusDangerForeground1",
          "tokens.colorStatusDangerBorder1"
        ]
      },
      {
        "name": "palette",
        "text": "Named colours for badges, avatars and presence, each with Background 1 to 3, Foreground 1 to 3, Border. Not for chrome.",
        "tokens": [
          "tokens.colorPaletteRedBackground1",
          "tokens.colorPaletteRedForeground1",
          "tokens.colorPaletteBlueBackground2",
          "tokens.colorPaletteGreenForeground3"
        ]
      }
    ],
    "pairing": "A foreground pairs with a background of the same family and level: colorNeutralForeground1 on colorNeutralBackground1, colorNeutralForegroundOnBrand on colorBrandBackground, colorStatusDangerForeground1 on colorStatusDangerBackground1. A level-2 foreground on a level-1 background is secondary text, still a valid pair.",
    "levels": "Background levels are depth, 1 nearest the reader: cards and inputs sit on 1, the page on 2 or 3, recessed wells on 4 to 6. In dark themes the order is the same; the greys invert.",
    "strokes": {
      "text": "Stroke 1 is a control's resting border, 2 a lighter divider, 3 the lightest; StrokeAccessible passes 3:1 against Background 1 for controls that must be findable by their border alone (checkbox, radio, switch off).",
      "tokens": [
        "tokens.colorNeutralStroke1",
        "tokens.colorNeutralStroke2",
        "tokens.colorNeutralStroke3",
        "tokens.colorNeutralStrokeAccessible",
        "tokens.colorNeutralStrokeAccessibleHover",
        "tokens.colorNeutralStrokeAccessiblePressed",
        "tokens.colorNeutralStrokeAccessibleSelected"
      ]
    },
    "brand": {
      "text": "Every brand alias resolves to one step of a 16-step ramp, brand 10 darkest to 160 lightest. Web light reads brand 80 as colorBrandBackground and brand 70 hover; dark reads 70 and 80. Teams supplies its own ramp; the alias mapping is the same.",
      "ramp": [
        10,
        20,
        30,
        40,
        50,
        60,
        70,
        80,
        90,
        100,
        110,
        120,
        130,
        140,
        150,
        160
      ],
      "tokens": [
        "tokens.colorBrandBackground",
        "tokens.colorBrandBackgroundHover"
      ]
    },
    "status": {
      "success": "green",
      "warning": "orange",
      "danger": "cranberry",
      "text": "statusColorMapping.ts binds each status to a shared palette; the status aliases copy that palette's tokens. A component may read a palette token directly instead: the progress bar's error is colorPaletteRedBackground3 and its warning colorPaletteDarkOrangeBackground3, not the status aliases.",
      "tokens": [
        "tokens.colorStatusDangerBackground1",
        "tokens.colorPaletteRedBackground3",
        "tokens.colorPaletteDarkOrangeBackground3"
      ]
    },
    "shadowColors": {
      "text": "Shadows are two layers, ambient then key, in the neutral shadow colours; brand-coloured surfaces use the brand pair through the shadow*Brand tokens.",
      "tokens": [
        "tokens.colorNeutralShadowAmbient",
        "tokens.colorNeutralShadowKey",
        "tokens.colorBrandShadowAmbient",
        "tokens.colorBrandShadowKey"
      ]
    }
  },
  "typography": {